{
  "transcript_metadata": {
    "processing_timestamp": "2025-10-06T13:42:30.222354",
    "source_file": "JodwaySchool transcript.pdf",
    "processing_version": "1.0",
    "total_courses": 31
  },
  "student_information": {
    "personal_details": {
      "first_name": "Kimberly Ann",
      "last_name": "Jodway",
      "full_name": "Kimberly Ann Jodway",
      "student_id": "8059022"
    },
    "academic_details": {
      "school_name": "Washington County Community College",
      "degree": "Assoc in Applied Science",
      "major": "Medical Assisting",
      "graduation_date": "05/15/2025",
      "gpa": "3.3890"
    }
  },
  "academic_record": {
    "courses": [
      {
        "course_identification": {
          "course_code": "CPT-112",
          "course_title": "Keyboarding & Document F.",
          "course_description": "Keyboarding & Document F."
        },
        "enrollment_details": {
          "semester": "Fall",
          "year": "2017-2018",
          "academic_period": "Fall 2017-2018"
        },
        "credit_information": {
          "credits_attempted": "3.00",
          "credits_earned": "0.00",
          "credit_type": "standard"
        },
        "grade_information": {
          "letter_grade": "F",
          "pass_fail_indicator": "CR",
          "grade_points": "",
          "grade_status": "completed"
        }
      },
      {
        "course_identification": {
          "course_code": "CPT-140",
          "course_title": "Word Processing",
          "course_description": "Word Processing"
        },
        "enrollment_details": {
          "semester": "Fall",
          "year": "2017-2018",
          "academic_period": "Fall 2017-2018"
        },
        "credit_information": {
          "credits_attempted": "3.00",
          "credits_earned": "0.00",
          "credit_type": "standard"
        },
        "grade_information": {
          "letter_grade": "F",
          "pass_fail_indicator": "CR",
          "grade_points": "",
          "grade_status": "completed"
        }
      },
      {
        "course_identification": {
          "course_code": "ENG-098",
          "course_title": "College Writing",
          "course_description": "College Writing"
        },
        "enrollment_details": {
          "semester": "Fall",
          "year": "2017-2018",
          "academic_period": "Fall 2017-2018"
        },
        "credit_information": {
          "credits_attempted": "3.00",
          "credits_earned": "0.00",
          "credit_type": "standard"
        },
        "grade_information": {
          "letter_grade": "W",
          "pass_fail_indicator": "CR",
          "grade_points": "",
          "grade_status": "completed"
        }
      },
      {
        "course_identification": {
          "course_code": "FYE-100",
          "course_title": "First Year Experience",
          "course_description": "First Year Experience"
        },
        "enrollment_details": {
          "semester": "Fall",
          "year": "2017-2018",
          "academic_period": "Fall 2017-2018"
        },
        "credit_information": {
          "credits_attempted": "1.00",
          "credits_earned": "0.00",
          "credit_type": "standard"
        },
        "grade_information": {
          "letter_grade": "F",
          "pass_fail_indicator": "PF",
          "grade_points": "",
          "grade_status": "completed"
        }
      },
      {
        "course_identification": {
          "course_code": "MAT-091",
          "course_title": "Algebra I",
          "course_description": "Algebra I"
        },
        "enrollment_details": {
          "semester": "Fall",
          "year": "2017-2018",
          "academic_period": "Fall 2017-2018"
        },
        "credit_information": {
          "credits_attempted": "3.00",
          "credits_earned": "0.00",
          "credit_type": "standard"
        },
        "grade_information": {
          "letter_grade": "W",
          "pass_fail_indicator": "CR",
          "grade_points": "",
          "grade_status": "completed"
        }
      },
      {
        "course_identification": {
          "course_code": "MDT-125",
          "course_title": "Medical Terminology",
          "course_description": "Medical Terminology"
        },
        "enrollment_details": {
          "semester": "Fall",
          "year": "2017-2018",
          "academic_period": "Fall 2017-2018"
        },
        "credit_information": {
          "credits_attempted": "3.00",
          "credits_earned": "0.00",
          "credit_type": "standard"
        },
        "grade_information": {
          "letter_grade": "F",
          "pass_fail_indicator": "CR",
          "grade_points": "",
          "grade_status": "completed"
        }
      },
      {
        "course_identification": {
          "course_code": "FYE-100",
          "course_title": "First Year Experience",
          "course_description": "First Year Experience"
        },
        "enrollment_details": {
          "semester": "Fall",
          "year": "2022-2023",
          "academic_period": "Fall 2022-2023"
        },
        "credit_information": {
          "credits_attempted": "1.00",
          "credits_earned": "1.00",
          "credit_type": "standard"
        },
        "grade_information": {
          "letter_grade": "A",
          "pass_fail_indicator": "CR",
          "grade_points": "",
          "grade_status": "completed"
        }
      },
      {
        "course_identification": {
          "course_code": "MDT-103",
          "course_title": "Introduction to Medical Assisting",
          "course_description": "Introduction to Medical Assisting"
        },
        "enrollment_details": {
          "semester": "Fall",
          "year": "2022-2023",
          "academic_period": "Fall 2022-2023"
        },
        "credit_information": {
          "credits_attempted": "3.00",
          "credits_earned": "3.00",
          "credit_type": "standard"
        },
        "grade_information": {
          "letter_grade": "A-",
          "pass_fail_indicator": "CR",
          "grade_points": "",
          "grade_status": "completed"
        }
      },
      {
        "course_identification": {
          "course_code": "CPT-140",
          "course_title": "Word Processing",
          "course_description": "Word Processing"
        },
        "enrollment_details": {
          "semester": "Fall",
          "year": "2022-2023",
          "academic_period": "Fall 2022-2023"
        },
        "credit_information": {
          "credits_attempted": "3.00",
          "credits_earned": "3.00",
          "credit_type": "standard"
        },
        "grade_information": {
          "letter_grade": "A+",
          "pass_fail_indicator": "CR",
          "grade_points": "",
          "grade_status": "completed"
        }
      },
      {
        "course_identification": {
          "course_code": "MDT-125",
          "course_title": "Medical Terminology",
          "course_description": "Medical Terminology"
        },
        "enrollment_details": {
          "semester": "Fall",
          "year": "2022-2023",
          "academic_period": "Fall 2022-2023"
        },
        "credit_information": {
          "credits_attempted": "3.00",
          "credits_earned": "3.00",
          "credit_type": "standard"
        },
        "grade_information": {
          "letter_grade": "A",
          "pass_fail_indicator": "CR",
          "grade_points": "",
          "grade_status": "completed"
        }
      },
      {
        "course_identification": {
          "course_code": "MDT-135",
          "course_title": "Clinical Office Procedures I",
          "course_description": "Clinical Office Procedures I"
        },
        "enrollment_details": {
          "semester": "Spring",
          "year": "2022-2023",
          "academic_period": "Spring 2022-2023"
        },
        "credit_information": {
          "credits_attempted": "4.00",
          "credits_earned": "4.00",
          "credit_type": "standard"
        },
        "grade_information": {
          "letter_grade": "A-",
          "pass_fail_indicator": "CR",
          "grade_points": "",
          "grade_status": "completed"
        }
      },
      {
        "course_identification": {
          "course_code": "MDT-130",
          "course_title": "Medical Office Management",
          "course_description": "Medical Office Management"
        },
        "enrollment_details": {
          "semester": "Spring",
          "year": "2022-2023",
          "academic_period": "Spring 2022-2023"
        },
        "credit_information": {
          "credits_attempted": "3.00",
          "credits_earned": "3.00",
          "credit_type": "standard"
        },
        "grade_information": {
          "letter_grade": "A-",
          "pass_fail_indicator": "CR",
          "grade_points": "",
          "grade_status": "completed"
        }
      },
      {
        "course_identification": {
          "course_code": "MDT-134",
          "course_title": "Medical Documentation",
          "course_description": "Medical Documentation"
        },
        "enrollment_details": {
          "semester": "Spring",
          "year": "2022-2023",
          "academic_period": "Spring 2022-2023"
        },
        "credit_information": {
          "credits_attempted": "3.00",
          "credits_earned": "3.00",
          "credit_type": "standard"
        },
        "grade_information": {
          "letter_grade": "A",
          "pass_fail_indicator": "CR",
          "grade_points": "",
          "grade_status": "completed"
        }
      },
      {
        "course_identification": {
          "course_code": "ENG-101",
          "course_title": "College Composition",
          "course_description": "College Composition"
        },
        "enrollment_details": {
          "semester": "Fall",
          "year": "2023-2024",
          "academic_period": "Fall 2023-2024"
        },
        "credit_information": {
          "credits_attempted": "3.00",
          "credits_earned": "3.00",
          "credit_type": "standard"
        },
        "grade_information": {
          "letter_grade": "A-",
          "pass_fail_indicator": "CR",
          "grade_points": "",
          "grade_status": "completed"
        }
      },
      {
        "course_identification": {
          "course_code": "ENG-101L",
          "course_title": "College Composition Lab",
          "course_description": "College Composition Lab"
        },
        "enrollment_details": {
          "semester": "Fall",
          "year": "2023-2024",
          "academic_period": "Fall 2023-2024"
        },
        "credit_information": {
          "credits_attempted": "1.00",
          "credits_earned": "1.00",
          "credit_type": "standard"
        },
        "grade_information": {
          "letter_grade": "P",
          "pass_fail_indicator": "PF",
          "grade_points": "",
          "grade_status": "completed"
        }
      },
      {
        "course_identification": {
          "course_code": "MDT-235",
          "course_title": "Clinical Office Procedures II",
          "course_description": "Clinical Office Procedures II"
        },
        "enrollment_details": {
          "semester": "Fall",
          "year": "2023-2024",
          "academic_period": "Fall 2023-2024"
        },
        "credit_information": {
          "credits_attempted": "3.00",
          "credits_earned": "3.00",
          "credit_type": "standard"
        },
        "grade_information": {
          "letter_grade": "A-",
          "pass_fail_indicator": "CR",
          "grade_points": "",
          "grade_status": "completed"
        }
      },
      {
        "course_identification": {
          "course_code": "MDT-223",
          "course_title": "Phlebotomy and Infection Control",
          "course_description": "Phlebotomy and Infection Control"
        },
        "enrollment_details": {
          "semester": "Fall",
          "year": "2023-2024",
          "academic_period": "Fall 2023-2024"
        },
        "credit_information": {
          "credits_attempted": "3.00",
          "credits_earned": "3.00",
          "credit_type": "standard"
        },
        "grade_information": {
          "letter_grade": "B",
          "pass_fail_indicator": "CR",
          "grade_points": "",
          "grade_status": "completed"
        }
      },
      {
        "course_identification": {
          "course_code": "MDT-227",
          "course_title": "Introduction to Pharmacology",
          "course_description": "Introduction to Pharmacology"
        },
        "enrollment_details": {
          "semester": "Fall",
          "year": "2023-2024",
          "academic_period": "Fall 2023-2024"
        },
        "credit_information": {
          "credits_attempted": "3.00",
          "credits_earned": "3.00",
          "credit_type": "standard"
        },
        "grade_information": {
          "letter_grade": "C",
          "pass_fail_indicator": "CR",
          "grade_points": "",
          "grade_status": "completed"
        }
      },
      {
        "course_identification": {
          "course_code": "MAT-091",
          "course_title": "Algebra I",
          "course_description": "Algebra I"
        },
        "enrollment_details": {
          "semester": "Spring",
          "year": "2023-2024",
          "academic_period": "Spring 2023-2024"
        },
        "credit_information": {
          "credits_attempted": "3.00",
          "credits_earned": "3.00",
          "credit_type": "standard"
        },
        "grade_information": {
          "letter_grade": "B-",
          "pass_fail_indicator": "CR",
          "grade_points": "",
          "grade_status": "completed"
        }
      },
      {
        "course_identification": {
          "course_code": "PHI-115",
          "course_title": "Ethics",
          "course_description": "Ethics"
        },
        "enrollment_details": {
          "semester": "Spring",
          "year": "2023-2024",
          "academic_period": "Spring 2023-2024"
        },
        "credit_information": {
          "credits_attempted": "3.00",
          "credits_earned": "3.00",
          "credit_type": "standard"
        },
        "grade_information": {
          "letter_grade": "B+",
          "pass_fail_indicator": "CR",
          "grade_points": "",
          "grade_status": "completed"
        }
      },
      {
        "course_identification": {
          "course_code": "PSY-101",
          "course_title": "Introduction to Psychology",
          "course_description": "Introduction to Psychology"
        },
        "enrollment_details": {
          "semester": "Spring",
          "year": "2023-2024",
          "academic_period": "Spring 2023-2024"
        },
        "credit_information": {
          "credits_attempted": "3.00",
          "credits_earned": "3.00",
          "credit_type": "standard"
        },
        "grade_information": {
          "letter_grade": "A",
          "pass_fail_indicator": "CR",
          "grade_points": "",
          "grade_status": "completed"
        }
      },
      {
        "course_identification": {
          "course_code": "MDT-221",
          "course_title": "Insurance Billing and Coding",
          "course_description": "Insurance Billing and Coding"
        },
        "enrollment_details": {
          "semester": "Spring",
          "year": "2023-2024",
          "academic_period": "Spring 2023-2024"
        },
        "credit_information": {
          "credits_attempted": "3.00",
          "credits_earned": "3.00",
          "credit_type": "standard"
        },
        "grade_information": {
          "letter_grade": "A",
          "pass_fail_indicator": "CR",
          "grade_points": "",
          "grade_status": "completed"
        }
      },
      {
        "course_identification": {
          "course_code": "MAT-106",
          "course_title": "College Mathematics for Technology",
          "course_description": "College Mathematics for Technology"
        },
        "enrollment_details": {
          "semester": "Fall",
          "year": "2024-2025",
          "academic_period": "Fall 2024-2025"
        },
        "credit_information": {
          "credits_attempted": "3.00",
          "credits_earned": "3.00",
          "credit_type": "standard"
        },
        "grade_information": {
          "letter_grade": "B-",
          "pass_fail_indicator": "CR",
          "grade_points": "",
          "grade_status": "completed"
        }
      },
      {
        "course_identification": {
          "course_code": "MDT-227",
          "course_title": "Introduction to Pharmacology",
          "course_description": "Introduction to Pharmacology"
        },
        "enrollment_details": {
          "semester": "Fall",
          "year": "2024-2025",
          "academic_period": "Fall 2024-2025"
        },
        "credit_information": {
          "credits_attempted": "3.00",
          "credits_earned": "3.00",
          "credit_type": "standard"
        },
        "grade_information": {
          "letter_grade": "A-",
          "pass_fail_indicator": "CR",
          "grade_points": "",
          "grade_status": "completed"
        }
      },
      {
        "course_identification": {
          "course_code": "PSY-207",
          "course_title": "Developmental Psychology",
          "course_description": "Developmental Psychology"
        },
        "enrollment_details": {
          "semester": "Fall",
          "year": "2024-2025",
          "academic_period": "Fall 2024-2025"
        },
        "credit_information": {
          "credits_attempted": "3.00",
          "credits_earned": "3.00",
          "credit_type": "standard"
        },
        "grade_information": {
          "letter_grade": "A-",
          "pass_fail_indicator": "CR",
          "grade_points": "",
          "grade_status": "completed"
        }
      },
      {
        "course_identification": {
          "course_code": "BUS-230",
          "course_title": "Supervisory Management",
          "course_description": "Supervisory Management"
        },
        "enrollment_details": {
          "semester": "Fall",
          "year": "2024-2025",
          "academic_period": "Fall 2024-2025"
        },
        "credit_information": {
          "credits_attempted": "3.00",
          "credits_earned": "3.00",
          "credit_type": "standard"
        },
        "grade_information": {
          "letter_grade": "A",
          "pass_fail_indicator": "CR",
          "grade_points": "",
          "grade_status": "completed"
        }
      },
      {
        "course_identification": {
          "course_code": "BIO-120",
          "course_title": "General Biology",
          "course_description": "General Biology"
        },
        "enrollment_details": {
          "semester": "Spring",
          "year": "2024-2025",
          "academic_period": "Spring 2024-2025"
        },
        "credit_information": {
          "credits_attempted": "4.00",
          "credits_earned": "4.00",
          "credit_type": "standard"
        },
        "grade_information": {
          "letter_grade": "A-",
          "pass_fail_indicator": "CR",
          "grade_points": "",
          "grade_status": "completed"
        }
      },
      {
        "course_identification": {
          "course_code": "MDT-240",
          "course_title": "Medical Assisting Capstone",
          "course_description": "Medical Assisting Capstone"
        },
        "enrollment_details": {
          "semester": "Spring",
          "year": "2024-2025",
          "academic_period": "Spring 2024-2025"
        },
        "credit_information": {
          "credits_attempted": "3.00",
          "credits_earned": "3.00",
          "credit_type": "standard"
        },
        "grade_information": {
          "letter_grade": "B",
          "pass_fail_indicator": "CR",
          "grade_points": "",
          "grade_status": "completed"
        }
      },
      {
        "course_identification": {
          "course_code": "MDT-245",
          "course_title": "Clinical Medical Co-op Practicum",
          "course_description": "Clinical Medical Co-op Practicum"
        },
        "enrollment_details": {
          "semester": "Spring",
          "year": "2024-2025",
          "academic_period": "Spring 2024-2025"
        },
        "credit_information": {
          "credits_attempted": "4.00",
          "credits_earned": "4.00",
          "credit_type": "standard"
        },
        "grade_information": {
          "letter_grade": "A+",
          "pass_fail_indicator": "CR",
          "grade_points": "",
          "grade_status": "completed"
        }
      },
      {
        "course_identification": {
          "course_code": "BUS-205",
          "course_title": "Business Communications",
          "course_description": "Business Communications"
        },
        "enrollment_details": {
          "semester": "Spring",
          "year": "2024-2025",
          "academic_period": "Spring 2024-2025"
        },
        "credit_information": {
          "credits_attempted": "3.00",
          "credits_earned": "3.00",
          "credit_type": "standard"
        },
        "grade_information": {
          "letter_grade": "B+",
          "pass_fail_indicator": "CR",
          "grade_points": "",
          "grade_status": "completed"
        }
      },
      {
        "course_identification": {
          "course_code": "CNA-110",
          "course_title": "Certified Nurses Assistant",
          "course_description": "Certified Nurses Assistant"
        },
        "enrollment_details": {
          "semester": "Fall",
          "year": "2015-2016",
          "academic_period": "Fall 2015-2016"
        },
        "credit_information": {
          "credits_attempted": "0.00",
          "credits_earned": "0.00",
          "credit_type": "standard"
        },
        "grade_information": {
          "letter_grade": "A",
          "pass_fail_indicator": "NC",
          "grade_points": "",
          "grade_status": "completed"
        }
      }
    ],
    "summary_statistics": {
      "total_credits_attempted": "87.0",
      "total_credits_earned": "71.0",
      "total_courses": 31,
      "overall_gpa": "3.3890"
    }
  },
  "additional_information": {
    "honors_awards": [],
    "transfer_credits": [],
    "notes": [],
    "extracted_fields": {
      "any_other_relevant_fields": null
    }
  },
  "raw_data": {
    "extracted_text": "Washington County Community College\nID : 8059022\nName : Kimberly Ann Jodway\nSSN : 004-98-9767\nAddress : PO Box 293\nLubec, ME 04652\nCredit Division\nAdvisors : Kieve Leeman\nLaurie Mahar\nCourse Number\nTitle\nCR Type Gra Rpt\nAtt Ernd HGpa\nQ.Pts\nGPA\n2017-2018 : Fall\nCPT-112\nKeyboarding & Document F. CR F\n3.00\n0.00\n3.00\n0.00\nCPT-140\nWord Processing\nCR F *\n3.00\n0.00\n3.00\n0.00\nENG-098\nCollege Writing\nCR W\n3.00\n0.00\n0.00\n0.00\nFYE-100\nFirst Year Experience\nPF F *\n1.00\n0.00\n1.00\n0.00\nMAT-091\nAlgebra I\nCR W *\n3.00\n0.00\n0.00\n0.00\nMDT-125\nMedical Terminology\nCR F *\n3.00\n0.00\n3.00\n0.00\nHonor : No honors this term\nTerm Totals :\n16.00\n0.00\n10.00\n0.00\n0.0000\nProbation : Academic Dismissal\nCareer Totals :\n6.00\n0.00\n3.00\n0.00\n0.0000\n9/2/2020 Appeal Granted, Academic Probation\n2022-2023 : Fall\nSubterm : Fall Full Term\nFYE-100\nFirst Year Experience\nCR A R\n1.00\n1.00\n1.00\n4.00\nSubterm Totals :\n1.00\n1.00\n1.00\n4.00\n4.0000\nSubterm : Fall 1st 8 Week Term\nMDT-103\nIntroduction to Medical Assis C CR\nA-\n3.00\n3.00\n3.00\n11.01\nSubterm Totals :\n3.00\n3.00\n3.00\n11.01\n3.6700\nSubterm : Fall 2nd 8 Week Term\nCPT-140\nWord Processing\nCR\nA+ R\n3.00\n3.00\n3.00\n12.00\nMDT-125\nMedical Terminology\nCR A R\n3.00\n3.00\n3.00\n12.00\nSubterm Totals :\n6.00\n6.00\n6.00\n24.00\n4.0000\nHonor : No honors this term\nTerm Totals :\n10.00\n10.00\n10.00\n39.01\n3.9010\nProbation : Good Standing\nCareer Totals :\n16.00\n10.00\n13.00\n39.01\n3.0000\n2022-2023 : Spring\nSubterm : Spring Full Term\nMDT-135\nClinical Office Procedures I CR A-\n4.00\n4.00\n4.00\n14.68\nSubterm Totals :\n4.00\n4.00\n4.00\n14.68\n3.6700\nCredit Division Advisors : Kieve Leeman Laurie Mahar\nCourse Number\nTitle\nCR Type Gra Rpt\nAtt Ernd HGpa\nQ.Pts\nGPA\n2022-2023 : Spring\nSubterm : Spring 1st 8 Week Term\nMDT-130\nMedical Office Management CR A-\n3.00\n3.00\n3.00\n11.01\nSubterm Totals :\n3.00\n3.00\n3.00\n11.01\n3.6700\nSubterm : Spring 2nd 8 Week Term\nMDT-134\nMedical Documentation\nCR A\n3.00\n3.00\n3.00\n12.00\nSubterm Totals :\n3.00\n3.00\n3.00\n12.00\n4.0000\nHonor : No honors this term\nTerm Totals :\n10.00\n10.00\n10.00\n37.69\n3.7690\nCareer Totals :\n26.00\n20.00\n23.00\n76.70\n3.3340\n2023-2024 : Fall\nSubterm : Fall Full Term\nENG-101\nCollege Composition\nCR\nA-\n3.00\n3.00\n3.00\n11.01\nENG-101L\nCollege Composition Lab\nPF\nP\n1.00\n1.00\n0.00\n0.00\nMDT-235\nClinical Office Procedures II CRA\nA-\n3.00\n3.00\n3.00\n11.01\nSubterm Totals :\n7.00\n7.00\n6.00\n22.02\n3.6700\nSubterm : Fall 1st 8 Week Term\nMDT-223\nPhlebotomy and Infection C CR B\n3.00\n3.00\n3.00\n9.00\nSubterm Totals :\n3.00\n3.00\n3.00\n9.00\n3.0000\nSubterm : Fall 2nd 8 Week Term\nMDT-227\nIntroduction to Pharmacolog CR C\n3.00\n3.00\n3.00\n6.00\nSubterm Totals :\n3.00\n3.00\n3.00\n6.00\n2.0000\nHonor : No honors this term\nTerm Totals :\n13.00\n13.00\n12.00\n37.02\n3.0850\nProbation : Good Standing\nCareer Totals :\n39.00\n33.00\n35.00\n113.72\n3.2490\n2023-2024 : Spring\nSubterm : Spring Full Term\nMAT-091\nAlgebra I\nCR\nB- R\n3.00\n3.00\n3.00\n8.01\nPHI-115\nEthics\nCR\nB+\n3.00\n3.00\n3.00\n9.99\nSubterm Totals :\n6.00\n6.00\n6.00\n18.00\n3.0000\nPage : 1 of 3\nWashington County Community College\nName : Kimberly Ann Jodway\nID : 8059022\nSSN : 004-98-9767\nAddress : PO Box 293\nLubec, ME 04652\nCredit Division\nAdvisors : Kieve Leeman\nLaurie Mahar\nCourse Number\nTitle\nCR Type Gra Rpt Att Ernd HGpa Q. Q.Pts\nGPA\n2023-2024 : Spring\nSubterm : Spring 1st 8 Week Term\nPSY-101\nIntroduction to Psychology\nCR A\n3.00\n3.00\n3.00\n12.00\nSubterm Totals :\n3.00\n3.00\n3.00\n12.00\n4.0000\nSubterm : Spring 2nd 8 Week Term\nMDT-221\nInsurance Billing and Codin, CR A\n3.00\n3.00\n3.00\n12.00\nSubterm Totals :\n3.00\n3.00\n3.00\n12.00\n4.0000\nHonor : DEAN'S LIST\nTerm Totals\n12.00\n12.00\n12.00\n42.00\n3.5000\nProbation : Good Standing\nCareer Totals :\n51.00\n45.00\n47.00\n155.72\n3.3130\n2024-2025 : Fall\nSubterm : Fall Full Term\nMAT-106\nCollege Mathematic for Tech CR B-\n3.00\n3.00\n3.00\n8.01\nMDT-227\nIntroduction to Pharmacolog CR A-\n3.00\n3.00\n3.00\n11.01\nPSY-207\nDevelopmental Psychology\nCR A-\n3.00\n3.00\n3.00\n11.01\nSubterm Totals :\n9.00\n9.00\n9.00\n30.03\n3.3360\nSubterm : Fall 2nd 8 Week Term\nBUS-230\nSupervisory Management\nCR A\n3.00\n3.00\n3.00\n12.00\nSubterm Totals :\n3.00\n3.00\n3.00\n12.00\n4.0000\nHonor : DEAN'S LIST\nTerm Totals :\n12.00\n12.00\n12.00\n42.03\n3.5020\nProbation : Good Standing\nCareer Totals\n63.00\n57.00\n59.00\n197.75\n3.3510\n2024-2025 : Spring\nSubterm : Spring Full Term\nBIO-120\nGeneral Biology\nCR A-\n4.00\n4.00\n4.00\n14.68\nMDT-240\nMedical Assisting Capstone CR B\n3.00\n3.00\n3.00\n9.00\nMDT-245\nClinical Medical Co-op Prac CR A+\n4.00\n4.00\n4.00\n16.00\nSubterm Totals :\n11.00\n11.00\n11.00\n39.68\n3.6070\nCredit Division\nAdvisors : Kieve Leeman\nLaurie Mahar\nCourse Number\nTitle\nCR Type Gra Rpt Att Ernd HGpa Q.Pts GPA\n2024-2025 : Spring\nSubterm : Spring 1st 8 Week Term\nBUS-205\nBusiness Communications CR B+\n3.00\n3.00\n3.00\n9.99\nSubterm Totals :\n3.00\n3.00\n3.00\n9.99\n3.3300\nHonor : DEAN'S LIST\nTerm Totals :\n14.00\n14.00\n14.00\n49.67\n3.5470\nCareer Totals :\n77.00\n71.00\n73.00\n247.42\n3.3890\nDivision Career Totals :\n77.00\n71.00\n73.00\n247.42\n3.3890\nDegree Information :\n(1) 'Assoc in Applied Science' Date Conferred : 05/15/2025 Major(s) Medical Assisting\nPage : 2 of 3\nWashington County Community College\nID : 8059022 Name : Kimberly Ann Jodway SSN : O04-98-9767 Address : PO Box 293 Lubec, ME 04652\nNon-Credit Division Advisors :\nCourse Number Title\nCR Type Gra Rpt Att Ernd HGpa Q.Pts\nGPA\n2015-2016 : Fall\nCNA-110\nCertified Nurses Assistant - NC A\n0.00\n0.00\n0.00\n0.00\nTerm Totals :\n0.00\n0.00\n0.00\n0.00\n0.0000\nCareer Totals :\n0.00\n0.00\n0.00\n0.00\n0.0000\nDivision Career Totals :\n0.00\n0.00\n0.00\n0.00\n0.0000\nPage : 3 of 3",
    "text_length": 5440
  }
}